Reviews,Aspects
" To top this off again for being so dead it took our food 43 minutes to get to our table, my drink sat empty for 15 minutes along with my dates drink for 12 minutes",serivice
"For fast food, they are really fast! This place is packed and there is a line and it is moving so quickly! The staff and management here are awesome!'",serivice
 I mean really: chilaquiles so close to home?!? They were delicious the first time but it's been a couple months - I need to get back there,food
" I mean how can you go wrong with unlimited beer and liquor? First they give you a glass to carry around to sample (yes a actual glass made of glass! They trust us so much) Then its a free for all, about 50 companies are represented here, so theres plenty to sample",serivice
" With so much variety there aren't a lot of long lines, which gives you the opportunity to sample a great deal",serivice
Room for improvement: The biggest let down was the food,food
" With a name like ""Beer, Bourbon, and BBQ"" you think they would have a lot of all 3, not so much of the last one",food
 Handful of BBQ vendors and hardly any BBQ samples,food
" Bathrooms, if you are going to have a big drinking event have lots of toilets, duh",ambience
 There were only about 15 or so port a potties and usually you waited in line for about 10 minutes to use one,ambience
 A good time though and I definitely drank $35 worth of booze,price
Usually a bit pricey for me but ordered the Farmhouse salad with roasted turkey and lt,"food,price"
  Italian dressing at $4. Let me tell you that is a delicious salad and under 300 cal with light dressing; can't go wrong,"food,price"
 A bit slow getting it but that's due to them making it fresh,food
"  That said, you wouldn't expect such great sushi from this place",food
  Why?  There's no seating (all take-out / delivery) and it's nothing but a basic kitchen set up with two guys working the sushi,ambience
  I did some research and found that the owner trained with Japanese Iron Chef himself - Morimoto!  While training is one thing - taste is another and to that point the sushi is fresh and first rate,food
"  How do you know they're the real deal?  When they list something on the menu, they actually have it --- unlike most local sushi joints that claim to have certain types of fish only to carry your bulk barn tuna and salmon",food
"The BBQ chicken was more like deep fried chicken, the skin was all burnt, the curry chicken has so many little bones inside in the curry and meat was really dry",food
"The only good thing was the spring rolls, which were freshly prepared!The restaurant suppose to close at 11 PM and they were mopping the floor while we were eating at 9:45 or so??!!! I don't really like the feeling that the waitstaffs are cleaning up the place with a mop and then turned around to the kitchen and served me my food! Gross!!Sigh","food,serivice"
 I love their lemon loaf,food
" But above average than other ""fresh"" products out there (a lot of gluten free breads etc are frozen, or stores sell them frozen)",food
"I like how they have an independent cafe, where you can actually get a meal as well -  AND a baked good","food,ambience"
"My real big con is this place is closed on Saturday!!! I don't live near here, and think it's rather ridiculous not to be opened on the ""shopping day"" for most people",serivice
The crispy gnocchi were coated in cheese curds and smothered in braised veal.  What a combination,food
" The gnocchi were not heavy, like others I've tried",food
 They were lighter and absolutely deep fry-able,food
 The veal melted in your mouth,food
 Instead of gravy the jus from the veal did the trick,food
 Apparently the Arancini is to die for,food
 My first thought was maybe my mom should relocate cause if you need a key to get into the bathroom at a establishment then you are probably in a bad area,ambience
 When I opened the door it smelled and looked like death and destruction,ambience
 When my meal comes out I ask for ketchup and the lady hands me 1 pack and tells me she is not allowed to give more than 1 pack per customer,serivice
 My fries were cold,food
 Romanburger wasnt even as good,food
 Bread was hard and although I said no tomatoes they decided it was best that I get tomatoes,food
 unfortunately the pizza Crust is made much more dry and buffalo chicken pizza now has tomatoes which really ruined the flavor,food
 Also they are pretty pricey for such a bland and basic pizza,price
 The mac and cheese is killer,food
 Have had pork ribs and turkey ribs and both were definitely delicious,food
 Staff is super friendly,serivice
 This is a great place and the food sells out quickly,food
"We went on Father's Day-understaffed, and inexperienced servers, not a good use of space with the tables( could have had many more) and the food, well, we wondered why the table next to us left most of theirs","food,ambience,serivice"
"After being served the food we understood why-muffins look great but were dry, the omelet and potatoes tasted like the canned greasethey were fried in (not a hit for our intestines either if you know what I mean, none of us felt that hot an hour later)  and even the salad dressing was gross",food
"We left ours too after spending 50 bux, sorry, this place was a miss","food,price"
"Indeed this place is a bit of a hole in the wall / hidden gem as it is unassuming with its faded exterior and retro interior but the sushi, sashimi, rolls and rice are outstanding - the salmon was so fresh and light tasting - very quality","food,ambience"
  The rice is so much better than standard fast food sushi joints - sort of Melt in your mouth,food
Had the chicken katsu meal which was great along with a spicy salmon roll and dynamite roll,food
" If you're used to the crunchy, shrimp tempura stuffed dynamite roll then you may find these less savoury but you can tell the ingredients are way fresher",food
"Not pricey either $40 for katsu chicken, two rolls, salmon sashimi and dessert",price
"Wings and sliders are great, burgers are meh, beer is good, but the OTB really brings down the energy",food
 The feeling of hopelessness follows OTB like a desperate ex-girlfriend,food
"We ordered from Uber eats, and the initial wait time was about 40 minutes",serivice
" We ended up waiting far longer, approximately 1.5hours and we live a little more than ten minutes away",serivice
" The pizza was really cold and Soggy so my guess is that it was more an Uber issue than the pizza, but Parma doesn't exactly strike me as an Uber Hotspot so that could also be the issue",food
"Noodles were very good but a bit salty, and the rest was very good",food
 Good price as well,price
 The staff is very attentive and professional,serivice
" The food is very good, my favorite is lamb",food
 The ambiance is modern unlike other Russian restaurants,ambience
I keep getting disillusioned with What A Bagel because of the prices,price
  A medium container of cream cheese is $13,price
 A challah bread is $5,price
This is the kind of salad/soup/sandwich place I've been hoping Charlotte would get,food
"  It's stylish, clean, and it's got a well laid-out menu board with plenty of options, so there's bound to be something everyone likes",food
" The line moves quickly and when I went yesterday, it was packed",serivice
 The folks working behind the counter were very friendly and quick to offer up their favorites and popular menu items,serivice
"Kind of like Crisp, you've got gourmet salads, or you can create your own",food
"  Prices wise, the gourmet salads range from $6 for a classic caesar, to $9",price
"50 for the tilapia, which I had, and was really yummy","food,price"
"  (Parmesan crusted tilapia, warm on carrots, edamame, bail and spring mix w/sesame ginger dressing) My only improvement would be to cook the fish less",food
" The edges were just a bit too crisp/tough, but the center was moist and flavorful",food
"My dining partner had the BBQ Santa Fe salad, which was excellent too-- chicken and corn, black beans, cilantro, cheese and tortilla strips",food
"We also had one of the soups of the day, a crab corn chowder, which was excellent, and frankly, could have been served at Upstream in a fancy bowl and nobody would have looked twice",food
"You can also get wraps, flatbreads and kids items (mmm, Nutella and berry wrap!), along with side items that are a bit more unique than at say, Subway, and more on-par with Au Bon Pain Think, Ms Vicky's chips, baked chips, and those little hummus containers with flat pretzel chips",food
"You'll pay less here than at Dean and Deluca (and honestly, they have most of the same salad items here maybe even more when you count the different proteins, like teriyaki chicken and pork tenderloin) and won't be overwhelmed with salad like at Crisp","food,price"
This location's service is just a tad ahead of the curve above every other Harvs location,serivice
"Authentic, fresh, and consistently delicious",food
" The menu is on the sparse side, but the dishes offered hit the mark",food
 The salsa verde is PERFECT: tangy and tasty with just the right hit of fresh cilantro,food
 You'll enjoy scooping it up with their homemade tortilla chips,food
 The beef tacos are generously filled; make sure to top them with fresh onion and cilantro,food
" If you can, try sharing a bunch of dishes; you can't go wrong",food
"As for the ambiance: on the plus side, it feels like you're sitting in someone's kitchen",ambience
"  The cooks are right there, prepping, frying, pouring",ambience
" On the minus side, it feels like you're sitting in someone's kitchen",ambience
 It's not the most comfortable dining experience and there's something about the layout that just doesn't sit well with me,ambience
 BUT I'm enchanted by the flavours and will keep on coming back again and again,food
 Derek and his partner on the line were helpful and friendly,serivice
 And the food being made in front of you is nice to see,food
 Loved it: smelled and tasted great!',food
 The bartenders were friendly & made an effort to get to know you,serivice
 After our second visit the bartender already knew my drink of preference,serivice
 They had great food too,food
" Really good chicken fingers!""",food
" DO NOT BE FOOLED this was by far the worst sushi I've ever had, and I've had sushi in Mexico",food
"The service was horrible, didn't even get a menu until sitting for 10 minutes",serivice
 The food was even worse,food
" I thought I'd be safe by getting a spicy salmon roll, but I was sadly mistaken",food
 This thing did not even look like a roll,food
 It had a huge chunk of what seemed like a few days old raw salmon in a horrible cream sauce,food
 I had to make a big effort not to spit it out when I was chewing it,food
" The other rolls were just okay, but the spicy salmon ruined my entire meal",food
"It took another 20 minutes for us to get the bill, and left one of us quite sick after our lunch",serivice
served me cooked sushi when i ordered raw,food
 refused to refund me,serivice
 very bad service from owner,serivice
 Froyo usually costs us at least $2 more dollars per person for about the same amount of ice cream,price
The kids like the mix in options and they have more ice cream flavors than I remember,food
 Ice cream is delicious too,food
The only complaint is that sometimes the portions between orders is inconsistent,serivice
 This is a super cute cafe ; very big with lots of seating and great lighting,ambience
" There are tons of teas, coffee beverages and unique beverages like the pumpkin spice latte and turmeric latte",food
" The meal was flavorful and tasted so very clean! I felt so full, but in the best way, after the salad",food
 The turmeric latte was very good as well -- I was surprised that it paired well with the coconut milk! As a proponent and fan of turmeric (haldi) I was pleased with the fact you could actually taste the turmeric,food
 The fact that they even had this was amazing!! Turmeric is so good for your health -- definitely try it out,food
"I think this place is great!  2 can eat a full dinner (tea, soup, appetizer of choice, 2 sides (1 rice & 1 noddle dish) and 2 ""entree"" options for under $30",price
  Their Take-Out is also ready in record time,serivice
 Under 15 minutes,serivice
" The restaurant has a good amount of seating, so go ahead and bring a mid sized group for dinner",ambience
"Before I get into the food, the service at Cucina Locale is close to my heart",serivice
" I'm about -20% Italian, but from start to finish, the staff will make you feel like you're around friends, and the food willhave you thinking that your nonna made it",serivice
" What can't be denied about the pizzas at Cucina Locale is that they're FRESH to def! You get that grandmother feel because from the freshly baked crust to the vividly flavourful prosciutto, the ingredients assure you that they were recently prepared",food
" That being said, there's more to a drop dead amazing pizza than outright freshness",food
" The Locale is a great pizza with classic, simple flavours, but it doesn't have the legs to be the best",food
" It was a stellar addition to the pie, giving it bouts of vibrant, salty flavour that sits on your pallet long after the meal",food
"Come through to Cucina for a delightful dinner and stellar service!""",serivice
" Delicious, spicy as you would expect from a place called Chili King, and very friendly service","food,serivice"
Great service and great coffee,"food,serivice"
I just got back from Bojangles and am pretty disappointed,food
"  First I ordered my food and they ""forgot"" to mention they have no more thighs until I already paid",serivice
" So they tried to replace it with 1 wing, seriously? I got two out if them but still that is ridiculous",serivice
" Then I got the food and checked it, my boyfriend got a 3 piece meal and they only put one one leg and their last thigh, they forgot the third piece",food
how does a fried chicken restaurant not have thighs and forget food? I am disappointed!',serivice
The cherry tabulah was outstanding,food
" Dried cherries, not couscous but buckwheat berries or something, fennel, raw cauliflower (personally, I think they should have been blanched a bit but still delicious)  cherry pomegranate dressing",food
 I will be back for that NO DOUBT!The spicy apricot quinoa was delicious too,food
" So flavorful and tasty with just the right amount of spice to kick it up a notch!My friend ordered the no preservtive, all beef angus hotdog and he really enjoyed it",food
 I want the zucchini lasagna,food
"If you like delicious, good food, and a very decent price, this is it!""","food,price"
 Overall great experience!!! The best crunch wrap supreme,food
MacAlpine's Soda Fountain is all right be me,food
"It's a cool place to meet up with some friends for an ice cream treat, soda or float",food
"  The food is OK, not great but not bad either",food
  The ice cream and soda treats are fantastic!  The ambiance ~ the soda bar is cool and there are two side rooms full of antiques that are for sale everywhere,"food,ambience"
"I've had their Reuben which was A-OK and on my last trip I sampled their burger and chips with chocolate shank which was shank-a-licious!!   My burger was cooked well, but nothing fancy",food
  I also had a small salad which was nice but not memorable,food
  My shake was really good and left an indelible impression on my taste buds,food
Omg I'm officially hooked! I was so happy to see that they have a veggie hotdog called the veggie dog!!  love that they offer the soy based dog! You'll never know its soy based! The flavor is on point & love the lime to squeeze on as extra flavor,food
 Nathans has good stuff,serivice
hot dogs are good,food
the fries are good,food
I liked this location because it's next to hot dog on a stick,ambience
"There are plenty of TVs about, so not an entirely bad place to watch a game",price
"  Food is always cold, slimy and/or stale",food
"  The location on Sloane was pretty bad, but they moved to this new location and the food actually got worse!  Poorly managed, I'd recommend going to another location",ambience
" But if you want to let your date knows how thrifty you are, this is the place to come for dim sum $1.98 for all sizes and on top you get 10% off!! Dim sum selections are quite standard but all the ones that we tried were decent",price
I honestly think people are missing the biggest thing on the menu which is the special DEEP FRIED CHICKEN,food
 This is my 100% go to because the fried chicken tastes so freaking good with the gravy that comes with the plate,food
ask for extra gravy sauce because its that delicious,food
 This is the place if your on a budget and its good portion size,price
